{
  "id": "bosgame-m4-neo",
  "nom": "BOSGAME M4 Neo",
  "gammes": ["business"],
  "cpu": { "modele_regex": "Ryzen 7 7840HS", "coeurs_min": 8 },
  "memoire_go": [64],
  "disque_go_min": 900,
  "reseau": { "ethernet": 2, "wifi": true, "bluetooth": true },
  "tpm": "2.0",
  "uefi": true,
  "secure_boot": true,
  "audio": { "sortie": true, "micro": false },
  "tests_obligatoires": ["materiel", "disque", "tpm", "reseau", "services", "commander", "controle", "ota"],
  "source": "Brief « iAgent Box Factory Installer » de max, 11/10/2026, §6 et §7 (exemple de qualification). Aucune machine reçue : fiche à relever sur l'échantillon.",
  "releve_le": "2026-10-11",
  "a_confirmer": true
}
