{
  "id": "exr1-home-v1",
  "nom": "EXR1 16 Go (Home Box)",
  "gammes": ["home"],
  "cpu": { "modele_regex": ".", "coeurs_min": 4 },
  "memoire_go": [16],
  "disque_go_min": 400,
  "reseau": { "ethernet": 1, "wifi": true, "bluetooth": true },
  "tpm": "2.0",
  "uefi": true,
  "secure_boot": true,
  "audio": { "sortie": true, "micro": true },
  "tests_obligatoires": ["materiel", "disque", "tpm", "reseau", "services", "audio", "commander", "controle", "ota"],
  "source": "Brief « iAgent Box Factory Installer » de max, 11/10/2026, §3 et §25 (micro, enceintes, AEC) ; 16 Go tranchés par max le 14/10/2026 (« la Home Box sera bien en 16 Go » ; le 11/10 il avait dit 32 Go, qui sont maintenant la Pro Box). Le processeur et le disque ne sont pas nommés dans le brief : seuils provisoires, à relever sur l'échantillon.",
  "releve_le": "2026-10-14",
  "a_confirmer": true
}
