{
  "id": "exr1",
  "nom": "EXR1 (Box Home)",
  "gammes": ["home"],
  "cpu": { "modele_regex": ".", "coeurs_min": 4 },
  "memoire_go": [16, 32],
  "disque_go_min": 400,
  "reseau": { "ethernet": 1, "wifi": true, "bluetooth": true },
  "tpm": "2.0",
  "uefi": true,
  "secure_boot": true,
  "audio": { "sortie": true, "micro": true },
  "tests_obligatoires": ["materiel", "disque", "tpm", "reseau", "services", "audio", "commander", "controle", "ota"],
  "source": "Brief « iAgent Box Factory Installer » de max, 11/10/2026, §3 (16/32 Go) et §25 (micro, enceintes, AEC). Le processeur et le disque ne sont pas nommés dans le brief : seuils provisoires, à relever sur l'échantillon.",
  "releve_le": "2026-10-11",
  "a_confirmer": true
}
